"Id";"Url";"Tipo";"Numero";"Data";"Processo";"Relator";"Interessado";"Ementa";"Assunto";"Documento";"Titulo"
"ceeal-resolucoes-1";"http://cee.al.gov.br/legislacao/atos-normativos/resolucoes-cee";"resolucoes";"145/2018-cee/al";"";"";"";"";"Dispõe sobre o estabelecimento de normas e procedimentos para ingresso de Conselheiros, por segmento, para a composição do Conselho Estadual de Educação de Alagoas – CEE/AL e dá outras providências.";"";"http://cee.al.gov.br/legislacao/atos-normativos/resolucoes-cee/RESOLUCaO%20No%20145-2018%20-%20Normas%20de%20ingresso%20de%20novos%20conselheiros.pdf";"RESOLUÇÃO Nº 145/2018-CEE/AL"
"ceeal-resolucoes-2";"http://cee.al.gov.br/legislacao/atos-normativos/resolucoes-cee";"resolucoes";"050/2018 - validação da eja";"";"";"";"";"Regulamentação da Educação de Jovens e Adultos no âmbito do Sistema Estadual de Ensino de Alagoas e dá outras providências.";"";"http://cee.al.gov.br/legislacao/atos-normativos/resolucoes-cee/RESOLUCaO%20No.%20050.2018%20-%20Regularizacao%20de%20Jovens%20e%20Adultos%20no%20ambito%20do%20Sistema%20Estadual%20de%20Ensino%20Alagoas.pdf";"Resolução 050/2018 - Validação da EJA"
"ceeal-resolucoes-3";"http://cee.al.gov.br/legislacao/atos-normativos/resolucoes-cee";"resolucoes";"01/2018 - cee/al - nova redação ao artigo 3º da 018/2017/cee/al,";"";"";"";"";"Dá nova redação ao Artigo 3º da Resolução 018/2017/CEE/Al, , que concede Atos Reguladores, em caráter excepcional para instituições educacionais das redes públicas e privadas de ensino.";"";"http://cee.al.gov.br/legislacao/atos-normativos/resolucoes-cee/RESOLUCaO%20No%201-2018%20-%20NOVA%20REDACaO%20ART%203%20DA%20RESOLUCaO%20No%2018-2017.pdf";"RESOLUÇÃO Nº 01/2018 - CEE/AL - Nova redação ao Artigo 3º da Resolução 018/2017/CEE/Al,"
"ceeal-resolucoes-4";"http://cee.al.gov.br/legislacao/atos-normativos/resolucoes-cee";"resolucoes";"018/2017 - cee/al - processos remanescentes no âmbito das câmaras de educação básica e de educação profissional do conselho estadual de educação de alagoas.";"";"";"";"";"Concede, em caráter excepcional, os Atos Reguladores das instituições educacionais das redes públicas e privadas do Sistema Estadual de Ensino de Alagoas, com processos remanescentes no âmbito das Câmaras de Educação Básica e de Educação Profissional do Conselho Estadual de Educação de Alagoas.";"";"http://cee.al.gov.br/legislacao/atos-normativos/resolucoes-cee/RESOLUCaO%20no%2018.2017%202013%20CEE-AL%20-Processos%20remanescentes%20no%20ambito%20das%20Camaras%20de%20Educacao%20Basica%20e%20de%20Educacao%20Profissional.pdf";"RESOLUÇÃO Nº 018/2017 - CEE/AL - Processos remanescentes no âmbito das Câmaras de Educação Básica e de Educação Profissional do Conselho Estadual de Educação de Alagoas."
"ceeal-resolucoes-5";"http://cee.al.gov.br/legislacao/atos-normativos/resolucoes-cee";"resolucoes";"normativa  02/2014 – cee/al";"";"";"";"";"Dispõe sobre a oferta de Educação Básica e Superior, nas modalidades de Educação de Jovens e Adultos, Profissional/Tecnológica e a Distância, para pessoas privadas de liberdade, nos estabelecimentos penais do Estado de Alagoas e dá outras providências correlatas.";"";"http://cee.al.gov.br/legislacao/atos-normativos/resolucoes-cee/Res%20no%2002-2014%20Educacao%20nas%20Prisoes%20Corrigida.pdf";"RESOLUÇÃO NORMATIVA Nº 02/2014 – CEE/AL"
"ceeal-resolucoes-6";"http://cee.al.gov.br/legislacao/atos-normativos/resolucoes-cee";"resolucoes";"028/2016 ceb/cep-cee/al";"";"";"";"";"Concede a Validação dos Estudos Ofertados até o Ano Letivo de 2016 pelas Escolas de Educação Básica do Sistema de Ensino de Alagoas e dá outras Providências.";"";"http://cee.al.gov.br/legislacao/atos-normativos/resolucoes-cee/RESOLUCaO%2028-2016%20CEB.CEP-CEE.AL.pdf";"RESOLUÇÃO Nº 028/2016 CEB/CEP-CEE/AL"
"ceeal-resolucoes-7";"http://cee.al.gov.br/legislacao/atos-normativos/resolucoes-cee";"resolucoes";"040/2014-cee/al";"";"";"";"";"Dispõe sobre a regulamentação da oferta de Educação do Campo no Sistema Estadual de Educação de Alagoas e dá outras providências correlatas.";"";"http://cee.al.gov.br/legislacao/atos-normativos/resolucoes-cee/2.%20Resoluaa7aa3o%20Normativa%20de%20Ed%20do%20Campo.pdf";"Resolução nº 040/2014-CEE/AL"
"ceeal-resolucoes-8";"http://cee.al.gov.br/legislacao/atos-normativos/resolucoes-cee";"resolucoes";"07/2014 -cee/al";"";"";"";"";"Define normas complementares para a implementação de Regras e Procedimentos Específicos para a Regulação das Instituições e Cursos do Sistema Estadual de Ensino Superior, frente à Resolução Nº 07/2014 CEE/AL, e estabelece providências correlatas.";"";"http://cee.al.gov.br/legislacao/atos-normativos/resolucoes-cee/Resol%20no%2007%20de%202014-CEE-AL-Ciclos%20Avaliativos.pdf";"RESOLUÇÃO Nº. 07/2014 -CEE/AL"
"ceeal-resolucoes-9";"http://cee.al.gov.br/legislacao/atos-normativos/resolucoes-cee";"resolucoes";"001/2002-cee/al";"";"";"";"";"Institui as Normas Gerais de funcionamento das Audiências Públicas do CEE/AL.";"";"http://cee.al.gov.br/legislacao/atos-normativos/resolucoes-cee/Resolucao%20%20n%20%2001%20%20-%20%20Audiencias%20Publicas.pdf";"RESOLUÇÃO Nº 001/2002-CEE/AL"
"ceeal-resolucoes-10";"http://cee.al.gov.br/legislacao/atos-normativos/resolucoes-cee";"resolucoes";"06/2014 -cee/al";"";"";"";"";"Redefine as normas do CEE/AL que estabelecem regras e procedimentos específicos para o Sistema Estadual de Ensino Superior frente ao Capítulo IV da Lei nº. 9.394/96 - LDBEN.";"";"http://cee.al.gov.br/legislacao/atos-normativos/resolucoes-cee/Resol%20no%2006%20de%202014-CEE-AL-Regulacao%20das%20IES.pdf";"RESOLUÇÃO Nº. 06/2014 -CEE/AL"
"ceeal-resolucoes-11";"http://cee.al.gov.br/legislacao/atos-normativos/resolucoes-cee";"resolucoes";"001 /2011 – cee/al";"";"";"";"";"Regulariza a vida escolar dos alunos das escolas atingidas pelas enchentes, em 18 de junho de 2010, e dá outras providências.";"";"http://cee.al.gov.br/legislacao/atos-normativos/resolucoes-cee/RESOLUCaO%20No%20001%20situacao%20escolar%20-1.pdf";"RESOLUÇÃO Nº 001 /2011 – CEE/AL"
"ceeal-resolucoes-12";"http://cee.al.gov.br/legislacao/atos-normativos/resolucoes-cee";"resolucoes";"53/2010 – cee/al";"";"";"";"";"Dispõe sobre a inclusão do nome social de travestis e transexuais os registros escolares nas Unidades de Ensino de educação básica do Sistema Estadual de Educação e dá outras providências.";"";"http://cee.al.gov.br/legislacao/atos-normativos/resolucoes-cee/resolucao%2053%20de%202010.pdf";"RESOLUÇÃO Nº 53/2010 – CEE/AL"
"ceeal-resolucoes-13";"http://cee.al.gov.br/legislacao/atos-normativos/resolucoes-cee";"resolucoes";"10/2007-cee/al";"";"";"";"";"REDEFINE AS NORMAS DO CEE/AL QUE ESTABELECEM REGRAS E PROCEDIMENTOS ESPECÍFICOS PARA O SISTEMA ESTADUAL DE ENSINO SUPERIOR FRENTE AO CAPÍTULO IV DA LEI N0. 9.394/96 - LDBEN.";"";"http://cee.al.gov.br/legislacao/atos-normativos/resolucoes-cee/resol_10_2007.pdf";"RESOLUÇÃO Nº.10/2007-CEE/AL"
"ceeal-resolucoes-14";"http://cee.al.gov.br/legislacao/atos-normativos/resolucoes-cee";"resolucoes";"ceb/cee/al 82/2010";"";"";"";"";"Estabelece Normas complementares para a Educação das Relações Étnico-raciais e a obrigatoriedade do ensino de História e Cultura Afro-brasileira, Afro- Alagoana, Africana e Indígena nos currículos escolares das instituições, públicas e privadas, integrantes do Sistema Estadual de Ensino do que dispõe as Leis Nacionais nº 10.639/03, nº 11.645/08 e a Lei Estadual 6.814/2007.";"";"http://cee.al.gov.br/legislacao/atos-normativos/resolucoes-cee/RESOLUCaO%20etnico%2082%202010.pdf";"RESOLUÇÃO CEB/CEE/AL Nº82/2010"
"ceeal-resolucoes-15";"http://cee.al.gov.br/legislacao/atos-normativos/resolucoes-cee";"resolucoes";"08/2007 ceb/cee-al";"";"";"";"";"Regulamenta a implantação do Ensino Fundamental de 09 anos no Sistema Estadual de Ensino de Alagoas e dá outras providências";"";"http://cee.al.gov.br/legislacao/atos-normativos/resolucoes-cee/resol_08_2007.pdf";"RESOLUÇÃO Nº. 08/2007 CEB/CEE-AL"
"ceeal-resolucoes-16";"http://cee.al.gov.br/legislacao/atos-normativos/resolucoes-cee";"resolucoes";"007/2007-cee/al";"";"";"";"";"Regulariza a vida escolar de estudantes da rede estadual de ensino de Educação Básica no ano letivo de 2006.";"";"http://cee.al.gov.br/legislacao/atos-normativos/resolucoes-cee/resol_07_2007.pdf";"RESOLUÇÃO Nº. 007/2007-CEE/AL"
"ceeal-resolucoes-17";"http://cee.al.gov.br/legislacao/atos-normativos/resolucoes-cee";"resolucoes";"055/2002 - cee/al";"";"";"";"";"Estabelece o limite máximo de vagas por turmas na Educação Básica no Sistema Estadual de Ensino de Alagoas.";"";"http://cee.al.gov.br/legislacao/atos-normativos/resolucoes-cee/resol_55_2002.pdf";"RESOLUÇÃO Nº 055/2002 - CEE/AL"
"ceeal-resolucoes-18";"http://cee.al.gov.br/legislacao/atos-normativos/resolucoes-cee";"resolucoes";"cee/al  007/2003";"";"";"";"";"Estabelece diretrizes para uma conduta ética dos avaliadores das instituições e situações educacionais no âmbito do Sistema Estadual de Ensino de Alagoas.";"";"http://cee.al.gov.br/legislacao/atos-normativos/resolucoes-cee/resol_07_2003.pdf";"RESOLUÇÃO CEE/AL Nº 007/2003"
"ceeal-resolucoes-19";"http://cee.al.gov.br/legislacao/atos-normativos/resolucoes-cee";"resolucoes";"025/2003 - cee/al";"";"";"";"";"Dispõe sobre o CALENDÁRIO ESCOLAR DO SISTEMA ESTADUAL DE ENSINO DE ALAGOAS e dá providências correlatas.";"";"http://cee.al.gov.br/legislacao/atos-normativos/resolucoes-cee/RESOLUCaO%20025-2003%20-%20CALENDARIO%20ESCOLAR%20DO%20SISTEMA%20ESTADUAL%20DE%20ENSINO%20DE%20ALAGOAS.pdf";"Resolução 025/2003 - CEE/AL"
"ceeal-resolucoes-20";"http://cee.al.gov.br/legislacao/atos-normativos/resolucoes-cee";"resolucoes";"51/ 2002-cee/al";"";"";"";"";"Estabelece normas para credenciamento de Instituições de Educação Básica, autorização e reconhecimento de etapas ou modalidades das Instituições de Educação Básica, do Sistema Estadual de Ensino de Alagoas.";"";"http://cee.al.gov.br/legislacao/atos-normativos/resolucoes-cee/resol_51_2002%20-2.pdf";"RESOLUÇÃO Nº 51/ 2002-CEE/AL"
"ceeal-resolucoes-21";"http://cee.al.gov.br/legislacao/atos-normativos/resolucoes-cee";"resolucoes";"anexos da 051/2002-cee/al";"";"";"";"";"Formulários anexos da Resolução n 051/2002-CEE/AL";"";"http://cee.al.gov.br/legislacao/atos-normativos/resolucoes-cee/Res%2051%20anexos.rar";"Anexos da Resolução 051/2002-CEE/AL"
"ceeal-resolucoes-22";"http://cee.al.gov.br/legislacao/atos-normativos/resolucoes-cee";"resolucoes";"048/2002-ceief/cem/cee/al";"";"";"";"";"";"";"http://cee.al.gov.br/legislacao/atos-normativos/resolucoes-cee/resol_48_2002.pdf";"RESOLUÇÃO Nº 048/2002-CEIEF/CEM/CEE/AL"
"ceeal-resolucoes-23";"http://cee.al.gov.br/legislacao/atos-normativos/resolucoes-cee";"resolucoes";"003/2002 - cee/al";"";"";"";"";"Regulamenta o Art. 33 da Lei 9.394/96 alterado pela Lei 9475/97 no âmbito do Sistema Estadual de Ensino de Alagoas e define normas correlatas.";"";"http://cee.al.gov.br/legislacao/atos-normativos/resolucoes-cee/resol_03_2002.pdf";"RESOLUÇÃO Nº 003/2002 - CEE/AL"
"ceeal-resolucoes-24";"http://cee.al.gov.br/legislacao/atos-normativos/resolucoes-cee";"resolucoes";"18/2002-cee/al";"";"";"";"";"Regulamenta a Educação de Jovens e Adultos no âmbito do Sistema Estadual de Ensino de Alagoas e dá outras providências.";"";"http://cee.al.gov.br/legislacao/atos-normativos/resolucoes-cee/resol_18_2002.pdf";"RESOLUÇÃO Nº 18/2002-CEE/AL"
"ceeal-pareceres-1";"http://cee.al.gov.br/legislacao/atos-normativos/pareceres-normativos";"pareceres";"070/2018 - processos remanescentes";"";"";"";"";"Concessão, em caráter excepcional, dos Atos Reguladores das instituições educacionais das redes públicas e privada do sistema estadual de ensino de Alagoas, com processos remanescentes no âmbito das Câmaras de Educação Básica e de Educação Profissional do Conselho Estadual de Educação de Alagoas.";"";"http://cee.al.gov.br/legislacao/atos-normativos/pareceres-normativos/Parecer%20No.%2070.2017-%20Processos%20Remanescentes.pdf";"PARECER Nº 070/2018 - Processos Remanescentes"
"ceeal-pareceres-2";"http://cee.al.gov.br/legislacao/atos-normativos/pareceres-normativos";"pareceres";"n° 133/2016 ceb/";"";"";"";"";"Validação dos Estudos Ofertados até o Ano Letivo de 2016 pelas Escolas de Educação Básica do Sistema de Ensino de Alagoas e dá outras Providências";"";"http://cee.al.gov.br/legislacao/atos-normativos/pareceres-normativos/VALIDACaO%20DE%20ESTUDOS.pdf";"PARECER N° 133/2016 CEB/"
"ceeal-pareceres-3";"http://cee.al.gov.br/legislacao/atos-normativos/pareceres-normativos";"pareceres";"01/2016-ceb-cee/al";"";"";"";"";"Consulta sobre a data de corte de matrícula para ingresso na Pré-escola e no 1º ano do Ensino Fundamental de 9 anos.";"";"http://cee.al.gov.br/legislacao/atos-normativos/pareceres-normativos/PARECER%2001-2016%20CEB.pdf";"Parecer 01/2016-CEB-CEE/AL"
"ceeal-pareceres-4";"http://cee.al.gov.br/legislacao/atos-normativos/pareceres-normativos";"pareceres";"158.2016";"";"";"";"";"Regulamentação da oferta de Cursos e Programas de Educação Profissional e Tecnológica, no Sistema Estadual de Ensino do Estado de Alagoas.";"";"http://cee.al.gov.br/legislacao/atos-normativos/pareceres-normativos/PARECER%20da%20EPT%20no%20158.2016%20Reg.%20oferta%20de%20cursos%20programas%20de%20educacao%20rpofissional%20e%20tecnologica%20no%20sistema%20estadual%20de%20ensino%20de%20alagoas.pdf";"Parecer nº 158.2016"
"ceeal-pareceres-5";"http://cee.al.gov.br/legislacao/atos-normativos/pareceres-normativos";"pareceres";"313/2014 - cee/al ";"";"";"";"";"ASSUNTO: Dispõe sobre a regulamentação da oferta de Educação do Campo no Sistema Estadual de Educação de Alagoas";"";"http://cee.al.gov.br/legislacao/atos-normativos/pareceres-normativos/1.%20Parecer%20de%20Ed%20do%20Campo%20para%20Pleno%20de%2011%20de%20nov.pdf";"PARECER Nº 313/2014 - CEE/AL "
"ceeal-pareceres-6";"http://cee.al.gov.br/legislacao/atos-normativos/pareceres-normativos";"pareceres";"029/2014-ces-cee/al de 25 de março de 2014.";"";"";"";"";"ASSUNTO: RESOLUÇÃO ESTADUAL SOBRE EDUCAÇÃO NO SISTEMA PRISIONAL DE ALAGOAS";"";"http://cee.al.gov.br/legislacao/atos-normativos/pareceres-normativos/Parecer%20029.2014%20-CES-CEE.AL%20Educacao%20nas%20Prisoes.pdf";"Parecer Nº 029/2014-CES-CEE/AL de 25 de março de 2014."
"ceeal-pareceres-7";"http://cee.al.gov.br/legislacao/atos-normativos/pareceres-normativos";"pareceres";"359/2010";"";"";"";"";"Estabelece normas complementares às Diretrizes Curriculares Nacionais para a Educação das Relações Étnico- raciais e a obrigatoriedade do Ensino da História e Cultura Afro- brasileira, Africana, Afro-alagoana e Indígena nos currículos escolares das Instituições públicas e privadas, integrantes do Sistema de Ensino de Alagoas, do que dispõe as Leis Nacional nº 10.639/03 e nº 11.645/08. PARECER Nº359 /2010";"";"http://cee.al.gov.br/legislacao/atos-normativos/pareceres-normativos/parecer%20etnico%20359%202010.pdf";"Parecer 359/2010"
"ceeal-pareceres-8";"http://cee.al.gov.br/legislacao/atos-normativos/pareceres-normativos";"pareceres";"115/2010";"";"";"";"";"ASSUNTO: Solicita inclusão do nome social das travestis e transexuais em documentos escolares";"";"http://cee.al.gov.br/legislacao/atos-normativos/pareceres-normativos/Parecer115%202010%20nome%20social%20das%20travestis.pdf";"Parecer 115/2010"
"ceeal-pareceres-9";"http://cee.al.gov.br/legislacao/atos-normativos/pareceres-normativos";"pareceres";"316.2009-cep-cee/al";"";"";"";"";"Implanta o SISTEC-MEC em Alagoas e da outras providências.";"";"http://cee.al.gov.br/legislacao/atos-normativos/pareceres-normativos/Parecer%20no%20316-2009-CEE-CEP-Implanta%20o%20SISTEC-MEC%20em%20Alagoas%20e%20da%20outras%20providencias.pdf";"Parecer 316.2009-CEP-CEE/AL"
"ceeal-pareceres-10";"http://cee.al.gov.br/legislacao/atos-normativos/pareceres-normativos";"pareceres";"383.2009-cep-cee/al";"";"";"";"";"Dispõe sobre a implantação dos Catálogos Nacionais de Cursos Técnicos e Tecnológicos do Ministério da Educação, no Sistema Estadual de Ensino de Alagoas.";"";"http://cee.al.gov.br/legislacao/atos-normativos/pareceres-normativos/Parecer%20no%20383-2009-CEE-CEP-Adota%20o%20Catalogo%20de%20Cursos%20Tecnicos%20do%20MEC.pdf";"Parecer 383.2009-CEP-CEE/AL"
"ceeal-pareceres-11";"http://cee.al.gov.br/legislacao/atos-normativos/pareceres-normativos";"pareceres";"n° 064/2002-cee";"";"";"";"";"ASSUNTO: Expulsão de aluno de unidade de Educação Básica.";"";"http://cee.al.gov.br/legislacao/atos-normativos/pareceres-normativos/PARECER%200642002CEE.AL.pdf";"PARECER N° 064/2002-CEE"
"ceeal-pareceres-12";"http://cee.al.gov.br/legislacao/atos-normativos/pareceres-normativos";"pareceres";"577.2004-cep-cee/al";"";"";"";"";"Regulamenta a oferta do Curso de Formação de Professores na modalidade Normal, em nível médio, no Sistema Estadual de Ensino do Estado de Alagoas.";"";"http://cee.al.gov.br/legislacao/atos-normativos/pareceres-normativos/Parecer%20no%20577-2004-CEE-CEP-Regulamenta%20a%20oferta%20do%20Ensino%20Normal%20em%20Alagoas.pdf";"Parecer nº 577.2004-CEP-CEE/AL"
"ceeal-pareceres-13";"http://cee.al.gov.br/legislacao/atos-normativos/pareceres-normativos";"pareceres";"151/2003";"";"";"";"";"ASSUNTO - Solicita parecer sobre criação da categoria “Escola Indígena” no âmbito da Educação Básica do Sistema de Ensino de Alagoas.";"";"http://cee.al.gov.br/legislacao/atos-normativos/pareceres-normativos/Parecer%20nb0%20151-Escolas%20Indigenas.pdf";"Parecer nº 151/2003"
